{
  "schema_version": "1",
  "scenario_id": "pump_outage_standby",
  "network_version": "procedural-capital-v1-seed1",
  "sensor_set": "S_base",
  "seed": 1,
  "start": "2027-03-04T22:00:00Z",
  "duration_hours": 48,
  "timestep_minutes": 5,
  "demand": {
    "calendar": "default_egypt",
    "holiday": false,
    "ramadan": false,
    "heatwave_multiplier": 1.0,
    "zone_multipliers": {},
    "forecast_error": {
      "model": "ar1",
      "sigma_pct": 0.0
    }
  },
  "faults": [
    {
      "type": "pump_outage",
      "start_hour": 20,
      "pump_id": "station_east_duty_0",
      "duration_hours": 6
    }
  ],
  "cross_domain_inputs": [],
  "assumption_set": "demand_v1"
}
