{
  "schema_version": "1",
  "scenario_id": "leak_sudden",
  "network_version": "capital_f1_v1",
  "sensor_set": "S_base",
  "seed": 42,
  "start": "2026-01-01T00:00:00Z",
  "duration_hours": 72,
  "timestep_minutes": 5,
  "demand": {
    "calendar": "default_egypt",
    "holiday": false,
    "ramadan": false,
    "heatwave_multiplier": 1.0,
    "zone_multipliers": {
      "gov": 1.0,
      "res": 1.0,
      "cbd": 1.0
    },
    "forecast_error": {
      "model": "ar1",
      "sigma_pct": 6.0
    }
  },
  "faults": [
    {
      "type": "leak",
      "location": "pipe:P_0101",
      "start_hour": 30,
      "profile": "sudden",
      "final_area_cm2": 3.5
    }
  ],
  "cross_domain_inputs": [],
  "assumption_set": "v1"
}
