{
  "schema_version": "1",
  "scenario_id": "heatwave",
  "network_version": "procedural-capital-v1-seed1",
  "sensor_set": "S_base",
  "seed": 1,
  "start": "2027-03-04T22:00:00Z",
  "duration_hours": 168,
  "timestep_minutes": 5,
  "demand": {
    "calendar": "default_egypt",
    "holiday": false,
    "ramadan": false,
    "heatwave_multiplier": 1.25,
    "zone_multipliers": {},
    "forecast_error": {
      "model": "ar1",
      "sigma_pct": 6.0
    }
  },
  "faults": [],
  "cross_domain_inputs": [],
  "assumption_set": "demand_v1"
}
