{
  "schema_version": "1",
  "scenario_id": "leak_gradual_medium",
  "network_version": "procedural-capital-v1-seed1",
  "sensor_set": "S_base",
  "seed": 1,
  "start": "2027-03-04T22:00:00Z",
  "duration_hours": 48,
  "timestep_minutes": 5,
  "demand": {
    "calendar": "default_egypt",
    "holiday": false,
    "ramadan": false,
    "heatwave_multiplier": 1.0,
    "zone_multipliers": {},
    "forecast_error": {
      "model": "ar1",
      "sigma_pct": 6.0
    }
  },
  "faults": [
    {
      "type": "leak",
      "profile": "gradual",
      "start_hour": 24,
      "location": "pipe:p_0276",
      "ramp_hours": 24,
      "final_area_cm2": 4.0
    }
  ],
  "cross_domain_inputs": [],
  "assumption_set": "demand_v1"
}
