{
  "schema_version": "1",
  "scenario_id": "pump_outage_with_dropout",
  "network_version": "capital_f1_v1",
  "sensor_set": "S_base",
  "seed": 42,
  "start": "2026-01-01T00:00:00Z",
  "duration_hours": 72,
  "timestep_minutes": 5,
  "demand": {
    "calendar": "default_egypt",
    "holiday": false,
    "ramadan": false,
    "heatwave_multiplier": 1.0,
    "zone_multipliers": {
      "gov": 1.0,
      "res": 1.0,
      "cbd": 1.0
    },
    "forecast_error": {
      "model": "ar1",
      "sigma_pct": 6.0
    }
  },
  "faults": [
    {
      "type": "pump_outage",
      "pump_id": "PU_01",
      "start_hour": 10,
      "duration_hours": 6
    },
    {
      "type": "sensor_dropout",
      "sensor_id": "F02",
      "start_hour": 12,
      "duration_hours": 2,
      "probability": 0.4
    },
    {
      "type": "comms_outage",
      "rtu_group": "RTU_3",
      "start_hour": 40,
      "duration_hours": 1.5
    },
    {
      "type": "fire_flow",
      "node": "node:J_0042",
      "start_hour": 50,
      "flow_l_s": 40,
      "duration_hours": 2
    }
  ],
  "cross_domain_inputs": [],
  "assumption_set": "v1"
}
